{
  "schemaVersion": "1.0.0",
  "manifest": {
    "id": "community.future-highlighter",
    "name": "Future Highlighter",
    "author": "A3 Fixture Author",
    "version": "1.0.0",
    "license": "MIT",
    "a3ApiVersion": "1.0.0",
    "origin": { "kind": "local-folder", "label": "future-highlighter" },
    "dependencies": [],
    "permissions": [],
    "obsidianCompatibility": "not-asserted",
    "extensions": {}
  },
  "contributions": [
    { "id": "community.future-highlighter.dsl", "extensionPoint": "a3.language", "apiVersion": "2.0.0", "payload": { "languageId": "community.future-highlighter.dsl", "aliases": ["fhl"], "rules": [ { "id": "community.future-highlighter.keyword", "kind": "keyword", "literals": ["future"] } ] } }
  ],
  "extensions": {}
}
